{
  "trend_or_value_choice": "Children's social behavior is increasingly tracked by learning platforms.",
  "optimistic_claim": "Better data will help teachers identify social-emotional needs early.",
  "affected_groups": ["children", "parents", "teachers"],
  "hidden_costs": ["privacy", "informal friendship", "right to change"],
  "daily_context": "kindergarten weekly reporting"
}
